https://cafe24img.poxo.com/wonlog11/web/product/medium/202408/2b946a3aebc82d393e37fb802ed2d04d.webp,[WONT/누적판매량 45만장!] 어텀 핀턱 슬랙스,[그레이 맥시 기장 추가] 누적판매량이 증명하는 원로그 스테디셀러 핀턱 슬랙스 24 autumn ver.   더욱 섬세한 디테일과 다양한 컬러 구성으로 준비했어요!,/product/wont누적판매량-45만장-어텀-핀턱-슬랙스/25263/category/58/display/1/
https://cafe24img.poxo.com/wonlog11/web/product/medium/202409/3f60798fbc6ce25f1a2d617732e1a2c7.webp,[WONT] 베베 레이어드 스커트,스트라이프 패턴+레이어드 밑단 디테일 스커트 아이템. 원로그만의 시즌 무드 가득 담아 제작한 레이어드 스커트.,/product/wont-베베-레이어드-스커트/25453/category/58/display/1/
https://cafe24img.poxo.com/wonlog11/web/product/medium/202409/a778783a606cb888cde735aab3c29105.webp,스틴 라운드 니트,보송보송 헤어리한 텍스처의 니트 아이템  입체적인 소재로 볼륨감 있는 상체 실루엣 연출,/product/스틴-라운드-니트/25445/category/58/display/1/
https://cafe24img.poxo.com/wonlog11/web/product/medium/202409/53476798acd35f697ef307da053fbe82.webp,[WONT] 리누아 텐셀 블라우스,하객룩.격식룩으로 추천드리는 단정한 무드의 블라우스. 피부에 자극 없는 매끄럽고 부드러운 텍스처까지,/product/wont-리누아-텐셀-블라우스/25454/category/58/display/1/
https://cafe24img.poxo.com/wonlog11/web/product/medium/202409/5e98f4d17060d54c714ea15b2577d0c4.webp,[WONT] 네버 꽈배기 베스트,f/w 시즌 레이어드 하기 좋은 니트 베스트. 넉넉한 암홀과 밑단 스트랩으로 디테일까지 챙겨준 베스트 아이템,/product/wont-네버-꽈배기-베스트/25455/category/58/display/1/
https://cafe24img.poxo.com/wonlog11/web/product/medium/202409/fc842aecf15594568dc1200a496550dd.webp,[WONT] 와이디 밴딩 팬츠,캐주얼하게 착용하기 좋은 이지웨어. 깔끔하게 떨어지는 와이드한 핏에 숏-롱 기장 옵션으로 준비했어요!,/product/wont-와이디-밴딩-팬츠/25456/category/58/display/1/
https://cafe24img.poxo.com/wonlog11/web/product/medium/202409/9ddab176c344f634abfe009dcc2d936f.webp,데릭 절개 데님,포인트가 되어주는 트렌디한 절개 라인 팬츠  베이직한 상의와도 포인트가 되어주는 데님 워싱,/product/데릭-절개-데님/25458/category/58/display/1/
https://cafe24img.poxo.com/wonlog11/web/product/medium/202409/77b6515cea4619e0cfb3fb4efc630418.webp,[소가죽100%] [WONT] 로일(belt),매끄러운 표면감의 천연소가죽 100% 로일 벨트. 포멀 룩부터 캐주얼 룩까지 다야한 룩에 더하기 좋은 벨트 아이템,/product/소가죽100-wont-로일belt/20301/category/58/display/1/
https://cafe24img.poxo.com/wonlog11/web/product/medium/202409/7f08183d623d09d6347e9e9152bbd805.webp,엘라 젬스톤 이어링,블랙톤 원석으로 포인트를 더해준 이어링. 우아한 무드 연출을 도와줄 이어링 아이템,/product/엘라-젬스톤-이어링/25457/category/58/display/1/
https://cafe24img.poxo.com/wonlog11/web/product/medium/202409/3f4251c97e08a87ceefdfcb564282522.webp,루네 셔츠 원피스,단독으로도 레이어드로도 활용도 높은 원피스. 여유있는 품의 루즈한 핏에 미디 기장감의 셔츠 원피스,/product/루네-셔츠-원피스/25452/category/58/display/1/
https://cafe24img.poxo.com/wonlog11/web/product/medium/202409/1c5f5e31df1e1fc3b3809901a27132ec.webp,로코 벨트 스커트,하객룩으로도 추천드리는 벨트 롱 스커트. 합포 원단으로 더욱 탄탄하고 포멀한 무드의 스커트 아이템,/product/로코-벨트-스커트/25450/category/58/display/1/
https://cafe24img.poxo.com/wonlog11/web/product/medium/202409/160c673433ff597b8158cd15948fb316.webp,다크 부츠컷 데님,은은한 세미 부츠컷 라인이 슬림하게 돋보이는 데님 !  다크한 블랙 색감으로 시크하면서도 내추럴 무드로  부담스럽지 않게 매일 입기 좋은 데일리 아이템,/product/다크-부츠컷-데님/22928/category/58/display/1/
https://cafe24img.poxo.com/wonlog11/web/product/medium/202409/c193ace0f53752574d0271a4c5329a2c.webp,앙고라 하프넥 티,무드 있는 코디 연출이 가능한 반폴라 티셔츠  이지한 실루엣으로 다양한 코디 연출 가능,/product/앙고라-하프넥-티/25416/category/58/display/1/
https://cafe24img.poxo.com/wonlog11/web/product/medium/202409/18013664128be2507c8e616a607736c7.webp,언티드 부츠컷 데님,드라마틱한 보정 효과를 더해줄 부츠컷 데님. 중청.흑청 2가지 컬러 구성으로 준비했어요!,/product/언티드-부츠컷-데님/25451/category/58/display/1/
https://cafe24img.poxo.com/wonlog11/web/product/medium/202409/869952ebf5fa78cb33099e3eb09326be.webp,퍼비 니트 가디건,포근한 텍스처의 니트 가디건.자연스러운 퍼프 디테일로 체형 보정 효과까지!,/product/퍼비-니트-가디건/25446/category/58/display/1/
https://cafe24img.poxo.com/wonlog11/web/product/medium/202409/53d91cdb51a77addf491343e28913a1b.webp,[캡 내장] 무이 골지 슬리브,이너로 활용하기 좋은 심플한 스트랩 슬리브리스. 편안하고 안정감 있는 착용감의 캡 내장 아이템,/product/캡-내장-무이-골지-슬리브/25448/category/58/display/1/
https://cafe24img.poxo.com/wonlog11/web/product/medium/202409/1be58f25d928ee3094601fb9099c67b5.webp,[팬츠 안감] 플레즈 셔링 스커트,스트랩을 더해준 러블리 무드의 플레어 스커트 팬츠 안감으로 노출 걱정 없이 착용하실 수 있어요 :),/product/팬츠-안감-플레즈-셔링-스커트/25447/category/58/display/1/
https://cafe24img.poxo.com/wonlog11/web/product/medium/202409/48076cda5a1e2f29bccde329b4aafde2.webp,[소가죽 100%] 올런 스웨이드 부츠,코디를 한 층 무드업 해 줄 스웨이드 부츠. 캐주얼하고 세련된 디자인의 롱 부츠 아이템,/product/소가죽-100-올런-스웨이드-부츠/25449/category/58/display/1/
https://cafe24img.poxo.com/wonlog11/web/product/medium/202409/8aea8de36553b5f9fed26eab4e265ff5.webp,[WONT] 셀로아 루즈 니트,코튼 소재로 피부에 거슬림 없는 세미 크롭 니트웨어.  다양한 코디업이 기대되는 아이템.,/product/wont-셀로아-루즈-니트/25421/category/58/display/1/
https://cafe24img.poxo.com/wonlog11/web/product/medium/202409/2c8b8e2a63915ab06751460dee0eaed9.webp,[WONT] 로하 훌 스커트,와이드하게 퍼지는 훌 스커트 아이템  취향에 맞게 코디 가능한 스트랩 디테일까지,/product/wont-로하-훌-스커트/25422/category/58/display/1/
https://cafe24img.poxo.com/wonlog11/web/product/medium/202409/14a2b775cdb2d1729d39efc7944fc36e.webp,[WONT] 퍼티그 비죠 팬츠, 네츄럴 무드의 워싱. 디테일으로 소장가치 충분한 팬츠.   웨스트 라인 비죠 디테일로 사이즈 조절이 가능한 로우라이즈 / 와이드핏의 매력적인 팬츠,/product/wont-퍼티그-비죠-팬츠/25402/category/58/display/1/
https://cafe24img.poxo.com/wonlog11/web/product/medium/202408/f9509c2abc0944c36adf4e07af43bdf3.webp,[WONT/매직시리즈] 데일리 젤리 팬츠,사계절 내내 캐주얼하게 착용하기 좋은 데일리 젤리 팬츠. 뛰어난 신축성과 내추럴한 세미 와이드 핏으로. 편안한 착용감을 자랑하는 소장가치 높은 아이템 !,/product/wont매직시리즈-데일리-젤리-팬츠/25200/category/58/display/1/
https://cafe24img.poxo.com/wonlog11/web/product/medium/202409/e70cf0a16040a23cbeadf50492b75171.webp,[WONT] 커버 라운드 가디건,간절기 시즌 활용하기 좋은 라운드 가디건  폴리. 뱀부 혼방 소재로 거슬림 없이 편안한 착용감,/product/wont-커버-라운드-가디건/25438/category/58/display/1/
https://cafe24img.poxo.com/wonlog11/web/product/medium/202409/a11a9d924e120dc775b168dcf0b5bf8f.webp,커비 크롭 티,입체감 있게 표현된 골지 짜임의 티셔츠  이너 착용은 물론 단독으로도 착용하기 좋은 아이템,/product/커비-크롭-티/25433/category/58/display/1/
https://cafe24img.poxo.com/wonlog11/web/product/medium/202409/a061c3fd2d00100760ed45846fb3700c.webp,리누 앙고라 뷔스티에,보송함을 가득 담은 앙고라 뷔스티에  포근하고 아늑한 무드의 레이어드 아이템,/product/리누-앙고라-뷔스티에/25384/category/58/display/1/
https://cafe24img.poxo.com/wonlog11/web/product/medium/202409/4af92b5ec315bff6a39252b21af3f999.webp,[소가죽 100%] 스웨이드 포켓 벨트,코디의 무드업을 도와주는 벨트 포켓 아이템  매트하게 표현된 소가죽 100% 소재,/product/소가죽-100-스웨이드-포켓-벨트/25410/category/58/display/1/
https://cafe24img.poxo.com/wonlog11/web/product/medium/202409/500f7d329d3a52600335feed02a72a63.webp,세라 슬림 니트,포슬포슬한 모헤어 원사가 눈길을 끄는 니트  실루엣을 감싸주는 여리여리한 슬림핏 아이템,/product/세라-슬림-니트/25412/category/58/display/1/
https://cafe24img.poxo.com/wonlog11/web/product/medium/202408/1abd72ab3473a03821cbd21f4282cdde.webp,우디 부츠컷 팬츠,슬림하고 롱한 다리 라인을 완성해줄 부츠컷 팬츠. 데일리한 컬러 구성과 탄탄한 코튼 100%의 베이직 아이템,/product/우디-부츠컷-팬츠/25317/category/58/display/1/
https://cafe24img.poxo.com/wonlog11/web/product/medium/202302/841914a22cf2e447a4caf5a21fede78f.webp,[기획특가] 이츠 라운드 니트,[20 color] 부드럽고 가벼운 텍스처로 이너로도 단독으로도 다양한 코디로 활용가능한 베이직한 니트 아이템!,/product/기획특가-이츠-라운드-니트/12413/category/58/display/1/
https://cafe24img.poxo.com/wonlog11/web/product/medium/202201/f497c4f948343e65be4184ac7c0bf5bb.webp,[누적판매량 5천장] 메리 퍼프 니트,숄더 라인의 퍼프로 볼륨감을 더해준 니트 아이템*.* 7가지 다채로운 컬러구성으로 준비했어요!,/product/누적판매량-5천장-메리-퍼프-니트/16925/category/58/display/1/
https://cafe24img.poxo.com/wonlog11/web/product/medium/202409/f5a5889dca3ca764b7138e6075306e16.webp,[WONT] 토프 데미지 데님,원로그만의 시그니쳐 세미 와이드 핏의 체형 커버 아이템.  데미지 워싱으로 포인트를 주었어요 !,/product/wont-토프-데미지-데님/25392/category/58/display/1/
https://cafe24img.poxo.com/wonlog11/web/product/medium/202409/2bf2cfc424625d38d5cf6928eb6553ce.webp,[WONT] 베이 플리츠 블라우스,세련된 무드를 더해주는 플리츠 블라우스  같은 라인의 스커트와 셋업으로 즐길 수 있는 아이템,/product/wont-베이-플리츠-블라우스/25423/category/58/display/1/
https://cafe24img.poxo.com/wonlog11/web/product/medium/202409/b4160b0cc2b259950570d1daaee652a5.webp,[WONT] 베이 플리츠 스커트,세련된 무드를 더해주는 플리츠 스커트  숏기장. 롱기장 2가지 기장 옵션으로 구성,/product/wont-베이-플리츠-스커트/25424/category/58/display/1/
https://cafe24img.poxo.com/wonlog11/web/product/medium/202409/ecefb98b2371e75ab391716e4495779c.webp,[WONT] 베이스 부츠컷 팬츠,헤비쭈리 소재로 늘어짐 없이 탄탄한 소재감과 밴딩 디테일로 편안하게 -   세미 슬림핏으로 바디라인은 슬림하게. 체형커버는 확실하게 :),/product/wont-베이스-부츠컷-팬츠/25403/category/58/display/1/
https://cafe24img.poxo.com/wonlog11/web/product/medium/202409/ea9811bdd0daed8a15bc54c4db4a23a2.webp,[WONT] 베이스 헤비 후드,덤블워싱 + 텐타가공 wont 베이스 라인의 새로운 후드 아이템 !   군더더기 없이 깔끔한 아일렛 펀칭으로 유행 없이 오래도록 함께 하실 수 있어요.,/product/wont-베이스-헤비-후드/25404/category/58/display/1/
https://cafe24img.poxo.com/wonlog11/web/product/medium/202408/add5429dfde1e6b61bc17b2abf172afb.webp,[WONT] 케이드 코튼 와이드 팬츠,[9.13 13:00 아이보리.카키 컬러 L사이즈 오픈!]  포멀한 느낌의 섬세한 디테일과 실루엣의 치노 팬츠  늘어짐 없이 밀도 높은 코튼 100 소재,/product/wont-케이드-코튼-와이드-팬츠/25273/category/58/display/1/
